{
  "schema_version": "1.0.0",
  "run_id": "4166dec0f4cf4fc99198be7dab016e5b",
  "created_at": "2026-09-27T14:05:55.262328+00:00",
  "code": {
    "schema_version": "1.0.0",
    "git_commit": null,
    "dirty": null,
    "pipeline_version": "0.1.0",
    "implementation_sha256": "c42933780029d7c2adb4c033297b20cf1c3e5f69360d4c628a30d521e799f14e"
  },
  "inputs": {
    "config_hash": "4cb84e4df03fb859f5f2f72a9199c43d1d7e04f496fe226e260f4c22e273cce8",
    "concept_hash": "d5cc7e23171b348aeb73d15bc9f6d6d27323657bf6518cb81431110d5fe5bf90",
    "prompt_template_versions": {
      "text": "1.0.0",
      "audio": "1.0.0",
      "image": "1.0.0"
    }
  },
  "assets": [
    {
      "schema_version": "1.0.0",
      "asset_id": "concept",
      "kind": "text",
      "provider": "dummy",
      "model": "local-algorithmic-fixture",
      "model_version": "1.0.0",
      "request_id": "8152f2ebb42a365818ebd93c",
      "prompt": "Local test brief: quiet night coding; instrumental only; original fixture.",
      "negative_prompt": "vocals, speech, artist imitation",
      "seed": 42,
      "generated_at": "2026-09-27T13:59:57.696822+00:00",
      "source_sha256": "d5cc7e23171b348aeb73d15bc9f6d6d27323657bf6518cb81431110d5fe5bf90",
      "terms_url": null,
      "usage": {
        "cost_usd": 0,
        "network_requests": 0
      },
      "intended_for_testing_only": true,
      "source_path": "stages/concept-001-2132e259/concept.json",
      "raw_response_path": "stages/concept-001-2132e259/concept.response.json",
      "raw_response_sha256": "f72244c2c4494e8a26f302bed5eca76571717bf07d9cc57053a7982831936710",
      "qc_report_path": null
    },
    {
      "schema_version": "1.0.0",
      "asset_id": "track-01",
      "kind": "audio",
      "provider": "dummy",
      "model": "local-algorithmic-fixture",
      "model_version": "1.0.0",
      "request_id": "460bd3cdc8639ccbcf351cd2",
      "prompt": "Algorithmic test signal: warm sine pad and gentle plucks; instrumental only.",
      "negative_prompt": "vocals, speech, artist imitation",
      "seed": 42,
      "generated_at": "2026-09-27T14:00:00.045851+00:00",
      "source_sha256": "79acd25e4f3318954fbcc5f9dfbaaac8b9738b2636c0f032570add0db32aa58f",
      "terms_url": null,
      "usage": {
        "cost_usd": 0,
        "network_requests": 0
      },
      "intended_for_testing_only": true,
      "source_path": "stages/music_generate-001-85e2c33a/track-01.wav",
      "raw_response_path": "stages/music_generate-001-85e2c33a/track-01.response.json",
      "raw_response_sha256": "eb9b1628d916cc6cb3d9f3cc4528ab24a2bb99403194613d65806edac5c0e39e",
      "qc_report_path": "stages/audio_qc-001-d61c8a40/track-01.json"
    },
    {
      "schema_version": "1.0.0",
      "asset_id": "track-02",
      "kind": "audio",
      "provider": "dummy",
      "model": "local-algorithmic-fixture",
      "model_version": "1.0.0",
      "request_id": "e365b88aa76a1c8eb10987cf",
      "prompt": "Algorithmic test signal: warm sine pad and gentle plucks; instrumental only.",
      "negative_prompt": "vocals, speech, artist imitation",
      "seed": 42,
      "generated_at": "2026-09-27T14:00:02.462613+00:00",
      "source_sha256": "60d681e41a04893f4588d348f501a893f7229fa8d0a78040875723ff57ec59c3",
      "terms_url": null,
      "usage": {
        "cost_usd": 0,
        "network_requests": 0
      },
      "intended_for_testing_only": true,
      "source_path": "stages/music_generate-001-85e2c33a/track-02.wav",
      "raw_response_path": "stages/music_generate-001-85e2c33a/track-02.response.json",
      "raw_response_sha256": "2dee304950fcc411df29cc8f7d5b767a891300b7436044c01cc0e91bd107a71f",
      "qc_report_path": "stages/audio_qc-001-d61c8a40/track-02.json"
    },
    {
      "schema_version": "1.0.0",
      "asset_id": "track-03",
      "kind": "audio",
      "provider": "dummy",
      "model": "local-algorithmic-fixture",
      "model_version": "1.0.0",
      "request_id": "9916ae269b073d623ab9bf8a",
      "prompt": "Algorithmic test signal: warm sine pad and gentle plucks; instrumental only.",
      "negative_prompt": "vocals, speech, artist imitation",
      "seed": 42,
      "generated_at": "2026-09-27T14:00:04.843611+00:00",
      "source_sha256": "2fbeb1e4b9255bc6af75cfe37ececc4104609704636548059f1d69ad8d1a1bf0",
      "terms_url": null,
      "usage": {
        "cost_usd": 0,
        "network_requests": 0
      },
      "intended_for_testing_only": true,
      "source_path": "stages/music_generate-001-85e2c33a/track-03.wav",
      "raw_response_path": "stages/music_generate-001-85e2c33a/track-03.response.json",
      "raw_response_sha256": "79c061972b538c7c5eba313ddf8d33061d4620db507de8001b28cb52ca98880d",
      "qc_report_path": "stages/audio_qc-001-d61c8a40/track-03.json"
    },
    {
      "schema_version": "1.0.0",
      "asset_id": "track-04",
      "kind": "audio",
      "provider": "dummy",
      "model": "local-algorithmic-fixture",
      "model_version": "1.0.0",
      "request_id": "fa72503b4f122e8e66c30482",
      "prompt": "Algorithmic test signal: warm sine pad and gentle plucks; instrumental only.",
      "negative_prompt": "vocals, speech, artist imitation",
      "seed": 42,
      "generated_at": "2026-09-27T14:00:07.254380+00:00",
      "source_sha256": "b1cc5e59e231f580fe1a7434745b588ac11dd48a078e4e9f438388c4ff68f823",
      "terms_url": null,
      "usage": {
        "cost_usd": 0,
        "network_requests": 0
      },
      "intended_for_testing_only": true,
      "source_path": "stages/music_generate-001-85e2c33a/track-04.wav",
      "raw_response_path": "stages/music_generate-001-85e2c33a/track-04.response.json",
      "raw_response_sha256": "13111fc7998118af678cba680f042a1658682c0c4b28aab4422e765cd1cbe589",
      "qc_report_path": "stages/audio_qc-001-d61c8a40/track-04.json"
    },
    {
      "schema_version": "1.0.0",
      "asset_id": "track-05",
      "kind": "audio",
      "provider": "dummy",
      "model": "local-algorithmic-fixture",
      "model_version": "1.0.0",
      "request_id": "fa6975ba58026fffcf2ca111",
      "prompt": "Algorithmic test signal: warm sine pad and gentle plucks; instrumental only.",
      "negative_prompt": "vocals, speech, artist imitation",
      "seed": 42,
      "generated_at": "2026-09-27T14:00:09.776510+00:00",
      "source_sha256": "0e214f52f6c47c96ead701600ad05c3be94d00bc6733a53d6888b5fc65d67091",
      "terms_url": null,
      "usage": {
        "cost_usd": 0,
        "network_requests": 0
      },
      "intended_for_testing_only": true,
      "source_path": "stages/music_generate-001-85e2c33a/track-05.wav",
      "raw_response_path": "stages/music_generate-001-85e2c33a/track-05.response.json",
      "raw_response_sha256": "11ca6ef4981c993309041819e2152c065b3b1b7b10d39c5d35084c695c7e3410",
      "qc_report_path": "stages/audio_qc-001-d61c8a40/track-05.json"
    },
    {
      "schema_version": "1.0.0",
      "asset_id": "track-06",
      "kind": "audio",
      "provider": "dummy",
      "model": "local-algorithmic-fixture",
      "model_version": "1.0.0",
      "request_id": "bed5fa921e74bb0f78ccc9f7",
      "prompt": "Algorithmic test signal: warm sine pad and gentle plucks; instrumental only.",
      "negative_prompt": "vocals, speech, artist imitation",
      "seed": 42,
      "generated_at": "2026-09-27T14:00:12.310108+00:00",
      "source_sha256": "6dfacdd836d7bcf968eb8df2dbe074b8cae9a0d1608d9865f44d520f6c0bf21f",
      "terms_url": null,
      "usage": {
        "cost_usd": 0,
        "network_requests": 0
      },
      "intended_for_testing_only": true,
      "source_path": "stages/music_generate-001-85e2c33a/track-06.wav",
      "raw_response_path": "stages/music_generate-001-85e2c33a/track-06.response.json",
      "raw_response_sha256": "136b166598f97c4e20c559ad76be9b15f2b1afb055957e17f03302d0917020c0",
      "qc_report_path": "stages/audio_qc-001-d61c8a40/track-06.json"
    },
    {
      "schema_version": "1.0.0",
      "asset_id": "track-07",
      "kind": "audio",
      "provider": "dummy",
      "model": "local-algorithmic-fixture",
      "model_version": "1.0.0",
      "request_id": "46a0dfddcd89caaf0d36f9e7",
      "prompt": "Algorithmic test signal: warm sine pad and gentle plucks; instrumental only.",
      "negative_prompt": "vocals, speech, artist imitation",
      "seed": 42,
      "generated_at": "2026-09-27T14:00:14.849864+00:00",
      "source_sha256": "b1817cbed60a061f9dfe9e2b44d2f77d93d7fff73cadd3e55e766df3ff4e195d",
      "terms_url": null,
      "usage": {
        "cost_usd": 0,
        "network_requests": 0
      },
      "intended_for_testing_only": true,
      "source_path": "stages/music_generate-001-85e2c33a/track-07.wav",
      "raw_response_path": "stages/music_generate-001-85e2c33a/track-07.response.json",
      "raw_response_sha256": "7d3740732ff7b9825534c8cc50a77a025030d3cf6378102caf274c1af340ace2",
      "qc_report_path": "stages/audio_qc-001-d61c8a40/track-07.json"
    },
    {
      "schema_version": "1.0.0",
      "asset_id": "track-08",
      "kind": "audio",
      "provider": "dummy",
      "model": "local-algorithmic-fixture",
      "model_version": "1.0.0",
      "request_id": "5963e0f5d4efb7b4036fb9b7",
      "prompt": "Algorithmic test signal: warm sine pad and gentle plucks; instrumental only.",
      "negative_prompt": "vocals, speech, artist imitation",
      "seed": 42,
      "generated_at": "2026-09-27T14:00:17.345850+00:00",
      "source_sha256": "25b89834072e08d1b2ba4c97fa761972fffbe7cdd94732d09b8cb583dbf7d11b",
      "terms_url": null,
      "usage": {
        "cost_usd": 0,
        "network_requests": 0
      },
      "intended_for_testing_only": true,
      "source_path": "stages/music_generate-001-85e2c33a/track-08.wav",
      "raw_response_path": "stages/music_generate-001-85e2c33a/track-08.response.json",
      "raw_response_sha256": "09cbd2f9a2df610efffeb16b5dc6ef0d8b699274ebcd8dafde101ecf41cc1bde",